{
  "flowId": "primary-canvas-loop",
  "title": "Canvas-first local prompt loop",
  "scenarioRefs": ["@SCN-CORE-001", "@SCN-CORE-002", "@SCN-CORE-003", "@SCN-ART-001", "@SCN-ART-002", "@SCN-ART-003"],
  "states": [
    { "id": "idle", "type": "screen" },
    { "id": "prompt_submitted", "type": "system" },
    { "id": "artifact_visible", "type": "screen" }
  ],
  "transitions": [
    { "id": "p1", "from": "idle", "to": "prompt_submitted", "trigger": "submit_prompt" },
    { "id": "p2", "from": "prompt_submitted", "to": "artifact_visible", "trigger": "turn_completed" }
  ]
}
