{
  "flowId": "warning-advisory",
  "title": "Advisory warnings without blocking",
  "scenarioRefs": ["@SCN-WARN-001", "@SCN-WARN-002", "@SCN-WARN-003"],
  "states": [
    { "id": "turn_in_progress", "type": "system" },
    { "id": "warning_emitted", "type": "status" },
    { "id": "turn_completed", "type": "screen" }
  ],
  "transitions": [
    { "id": "w1", "from": "turn_in_progress", "to": "warning_emitted", "trigger": "risk_detected" },
    { "id": "w2", "from": "warning_emitted", "to": "turn_completed", "trigger": "prompt_dispatched" }
  ]
}
