{
  "flowId": "terminal-drawer-continuity",
  "title": "Terminal drawer continuity",
  "scenarioRefs": ["@SCN-TERM-001", "@SCN-TERM-002", "@SCN-TERM-003"],
  "states": [
    { "id": "hidden", "type": "screen" },
    { "id": "visible", "type": "terminal" },
    { "id": "detached", "type": "error" }
  ],
  "transitions": [
    { "id": "t1", "from": "hidden", "to": "visible", "trigger": "open_drawer" },
    { "id": "t2", "from": "visible", "to": "hidden", "trigger": "close_drawer" },
    { "id": "t3", "from": "visible", "to": "detached", "trigger": "attachment_lost" }
  ]
}
